{
  "id": "sprint-001",
  "goal": "Implement user management",
  "type": "development",
  "status": "active",
  "pbi_ids": ["pbi-001"],
  "developer_count": 1,
  "developers": [
    {
      "id": "dev-001-s1",
      "assigned_work": {
        "implement": ["pbi-001"],
        "review": []
      },
      "status": "active",
      "sub_agents": []
    }
  ],
  "started_at": "2026-03-01T10:00:00Z",
  "completed_at": null
}
